match on,disclosure when
quasi-identifiers for specific individual,quasi-identifier key is unique/rare
quasi-identifiers for specific group,sensitive values are homogeneous for quasi-identifier key
partial quasi-identifiers and partial sensitive values for unknown individual,quasi-identifiers are homogeneous for certain sensitive values
complete quasi-identifiers and partial sensitive values for a known individual,sensitive values are homogeneous for a quasi-identifiers key and known sensitive values
quasi-identifiers for specific group,sensitive values are homogeneous or all of high severity for a quasi-identifier key